ID,Quality,Difficulty,Class_Name,Date_Taken,textbook,attendence,grade,take_again,credit,Tags,Comment
475609,5.0,2.0,ES2013,"Dec 20th, 2017", No, Mandatory, A, Yes, Yes,"['GIVES GOOD FEEDBACK', 'RESPECTED', 'CLEAR GRADING CRITERIA']","He is very straightforward, and his great handwriting is famous in the ME department. Tests are quite easy. Good sense of humor and doesnt disrespect students."
137782,1.0,5.0,STATISTICSI,"Jan 13th, 2014", No,,,,,[],"Jan 13th, 2014"
1258015,2.5,5.0,ACCT7143,"Jul 10th, 2012", No,,,,,[],This class is super difficult and intense. The class is fully online and assignments given are vague relative to class materials provided.
1995154,2.0,4.0,PSY3013,"Feb 27th, 2019", No, Mandatory,, No, Yes,"[""SKIP CLASS? YOU WON'T PASS."", 'TEST HEAVY', 'TOUGH GRADER']",This class made me not want to be a psych major anymore
475609,3.0,3.0,ES2013,"Apr 3rd, 2017", No, Mandatory, A, Yes, Yes,[],"Very boring professor. Very nice. Need to go to lectures, because teaches off notes. 3 tests, homework, and final. Hard A, decent B."
137782,2.0,5.0,QM2013,"Apr 11th, 2013", Yes,,,,,[],"This is a very difficult class, because there are no lecture notes prepared for class that day. Instead Gebhart sits down and forces the class to ask questions on the reading. The book itself can be very confusing but is necessary. Don't expect much help from the questions in class. You will need to teach yourself everything."
475609,4.0,3.0,ME3043,"May 8th, 2016", Yes, Not Mandatory, B,, Yes,[],"Do the homework with caution, if you lose too many points on that you can't get A. He use the 10,7,5,0 to grade homework. And he changes problem even though you have old exams, that won't help too much. But old exam indeed helps. Overall, easy B, if you do everything carefully, A is not hard."
1995154,4.0,3.0,PSY3013,"Dec 22nd, 2018", Yes, Not Mandatory, A, Yes, Yes,"['CLEAR GRADING CRITERIA', 'TEST HEAVY', 'GROUP PROJECTS']","Dr Ragsdales Research Methods class involves a group research project which includes a lot of steps over the course of the semester and a lot of help to get to the finished project, as well as tests. She is extremely helpful and makes the content very accessible, and provides numerous resources to help."
137782,2.5,5.0,QM2013,"Dec 18th, 2011", Yes,,,,,[],"Both Stat I and II are very hard. Gebhart is a nice person but expects students to be mature and ask questions if the material is not clear. He claims that his role is not to regurgitate the book, it is only to clarify any questions that one may have as they struggle through the class. It is definitely not an easy class but an A is attainable."
137782,1.0,5.0,QM2013,"Dec 11th, 2011", Yes,,,,,[],"Gebhart hardly lectures or teaches during class periods. Students, when asking questions, must be prepared to feel stupid and will be belittled. Be prepared to teach yourself and make sure you get 100% on all homework. Good luck you will need it."
1995154,4.0,3.0,PSY3013,"Nov 17th, 2018", No, Not Mandatory, A, Yes, Yes,"['PARTICIPATION MATTERS', ""SKIP CLASS? YOU WON'T PASS."", 'CLEAR GRADING CRITERIA']","It's a boring topic, but you'll get a lot of good info from class. She doesn't put lectures online so don't skip class."
475609,4.0,2.0,ME 3043,"Oct 25th, 2015", Yes, Not Mandatory, A+,, Yes,[],Dr. McLaury gives you all the equations and concepts you need. Keep track of them. Put them on an equation sheet. Do the homework for practice and you will succeed on his exams. It's that kind of class. When I took the class the text he used was free and online and we had a joke competition every Friday!
137782,1.0,5.0,STAT1,"Jun 12th, 2011", No,,,,,[],"He is not a teacher in the slightest. Be prepared to teach yourself all of the material. And he makes you feel like a fool when you ask for help in class. Good luck, you'll need it."
475609,5.0,1.0,SOLIDPARTICLE,"Oct 8th, 2013", Yes,,,,,['GREAT PROFESSOR'],GREAT PROFESSOR
137782,2.0,4.0,QM2023,"May 16th, 2011", Yes,,,,,[],"He iss a very nice guy but a horrible teacher. Read the book and I reccomend khanacademy.org, there are videos that will help a but. Also, utilize the ti-84/89 website and how-tos for simple calculations such as stdeviation, and binomial distribution. If you can get out of having him, do it, you WILL NOT GET YOUR MONEY'S WORTH WITH HIM AS A TEACHER"
1995154,4.0,3.0,PSY3013,"Oct 31st, 2018", Yes, Mandatory, A, Yes, Yes,"['GIVES GOOD FEEDBACK', 'CLEAR GRADING CRITERIA', 'EXTRA CREDIT']","She does use power points but they aren't put online, so attend class. The textbook is actually good to read for review, but not necessary. Take notes and pay attention, then do the review and study guide she posts online and you can get an A. This topic can be inherently boring, but Ragsdale's use of examples helps it make sense."
475609,5.0,2.0,SOLIDPARTICLE,"Jun 14th, 2013", Yes,,,,,[],Awesome Professor.
1266475,2.5,5.0,ENGL1033,"Jan 4th, 2010", Yes,,,,,[],"In a class that most engineers fly through with other professors, this was made to be incredibly difficult. I believe one person in our class got an A. I understand him being concerned about our writing skills, but he was unclear and was a total tool bag."
137782,1.0,5.0,QM2013,"Oct 21st, 2010", Yes,,,,,[],"Tells stories in class. For my section he tested out a program 20 percent of which was from stat 2. He was aware of this and didn't teach the material. He also didn't curve it based on that. (curve was maybe 1%, if that). This man never should have been employed as a teacher. Be prepared to teach yourself."
475609,4.0,3.0,ME3043,"May 17th, 2011", No,,,,,[],"Very helpful and nice guy. For people that are interested in this and/or liked thermo, this class will be fairly easy."
1266475,4.0,5.0,ENG1013,"Apr 2nd, 2009", No,,,,,[],He teaches English pretty well. He also will edit your paper and tell you what exactly you need to improve on. He grades really hard and gives a but load of assignments. I suggest not taking his class if you want a life. You will have an essay due every week which you will probably get a C or lower on. Save your time and GPA and try to avoid him.
137782,5.0,4.0,STAT2023,"Oct 1st, 2010", Yes,,,,,[],"very helpful. just give him a try. go to class. he expects you to read before class, but is very helpful in class"
475609,5.0,3.0,ME3043,"Aug 26th, 2008", Yes,,,,,[],"Aug 26th, 2008"
137782,3.0,5.0,STAT2023,"Aug 4th, 2009", Yes,,,,,[],"This class is very difficult and is almost totally self taught, but Gebhart is a really nice guy. All these people that say they don't like him didn't go to class because they were intimidated by him and then want to whine over their grade. I piece of advice, stay after class one day and get to know him and read the book before class everytime."
475609,4.5,3.0,ME4343,"Oct 20th, 2004",,,,,,[],McLaury was really helpful in answering student questions. The material for the most part was very interesting. Good professor and material geared more to what the students were interested in.
137782,4.0,4.0,STAT1,"Jun 14th, 2009", Yes,,,,,[],you must prepare. this is a hard class and requires work. Professor is helpful.
137782,1.5,5.0,STATS1,"May 16th, 2009", Yes,,,,,[],"Your grade is based on 3 tests and a program called ALEKS. Your grade on ALEKS is based on the ""Course Mastery"" number (x/97) under Assessment Mode in the Reports Section. There is also a curve, but he won't talk about it and you shouldn't depend on it. Overall, a really tough class because you have to teach yourself everything."
137782,1.5,5.0,QM2013,"May 12th, 2009", Yes,,,,,[],"Be prepared to read the book outside of class so that you can understand what's going on. He doesn't lecture much, and when asked questions, confuses students even more while insulting them at the same time. I feel that I am owed the money that I payed for this class, since I practically taught myself everything."
137782,4.5,5.0,STAT1,"Apr 17th, 2009", Yes,,,,,[],"Gebhart is a no-nonsense professor. Read before coming to class. Do not go to sleep in class. If you have a funny or unusual last name, be ready to answer questions in class. The tests aren't impossible, but they aren't something you can gloss over the night before. A word of advice: Don't put off ALEKS till the last week of class. Very Good Prof."
1272336,4.0,1.0,MARCHINGBAND,"May 16th, 2013", No,,,,,[],"Mean. Yells when he is angry, which is a fair amount of the time. Ruined my chops."
137782,5.0,5.0,STAT2013,"Aug 14th, 2008", Yes,,,,,[],Couldn't ask for a better teacher. Show him respect and he will you. Work hard and the grade will come.
1272336,5.0,1.0,MBAND0021,"May 17th, 2011", No,,,,,[],Sarge is pretty understanding but the only thing to watch out for is showing up on time and ready to work during rehearsal. If you know your part and give your best during marching then he is understanding if other things come up.
137782,5.0,3.0,QM2023,"Apr 6th, 2008", Yes,,,,,[],great professor
1272336,5.0,1.0,MUS0021,"Dec 21st, 2010", No,,,,,[],"Sarge is great, very easy to talk to and joke around with. He has some very interesting stories as well. Show up to rehearsal and you'll be fine. Not much to worry about with this one!"
137782,1.0,4.0,STAT1003,"Feb 18th, 2008", Yes,,,,,[],gebhart doesn't teach. he makes you read the textbook and expects you to know all the information prior to coming to class so he doesn't have to teach anything.
485624,4.0,2.0,BIOL4623,"Apr 9th, 2018", No, Not Mandatory,, Yes, Yes,"['CLEAR GRADING CRITERIA', 'GRADED BY FEW THINGS', 'GROUP PROJECTS']","Material is interesting, lectures and be a bit monotonous. Tests are pretty easy to study for if you can adequately answer the questions on her study guides. She does sometimes add extra notes not on her slides so either have a friend in class or don't miss lectures. There's article summaries too, and a group presentation at the end of the year."
2010949,4.0,4.0,SOC3093,"Aug 18th, 2022", N/A, Mandatory, C, Yes, Yes,"['TOUGH GRADER', 'GIVES GOOD FEEDBACK', 'CARING']","dr lowe is a great guy, and he is very knowledgable in the world of sociology. His classes are hard, and he wants a lot of specifics, but he is available outside of class and is always willing to help you out. I got two C's in his classes because i'm a moron, that's not his fault."
137782,3.5,4.0,STAT12,"Oct 28th, 2007", Yes,,,,,[],"Overbearing personality, probably would benefit from a pedagogy class. But when I went to his office for help he was kind, helpful, friendly, and made sure I understood before I left. I hated that he dismissed class early a lot... I paid ~$800 per credit hour; I want my lecture time for that kind of money. He owes me half a semester of lectures."
485624,5.0,4.0,BIOL4,"Jul 2nd, 2012", No,,,,,[],"had her for Medical Botany. It's nice to have a teacher that really loved what they are teaching. She was very helpful, and will bend over backwards to help a student who is trying to do well in her class. She does expect a lot, though. Once you realize how thorough your studying should be, you're golden."
2010949,1.0,5.0,SOC1033,"May 6th, 2015", Yes,,,, Yes,[],"This is an introductory Sociology class. It could be quite interesting, if taught with any enthusiasm. Instead, it was boring, unnecessarily difficult, and purely academic. I would love to take this with a different professor. Don't hate Sociology because of this one class."
137782,2.0,5.0,QM2013,"Oct 23rd, 2007", Yes,,,,,[],"Insulted all religion on first day of class. Has a God complex. Tries to be helpful, but ends up making students feel stupid."
485624,5.0,2.0,BIOL3314,"Jan 29th, 2011", No,,,,,[],She is extremely kind and helpful if you show that you put the effort into her class. Her tests are certainly fair and do require some study time but if you can commit to it you will be just fine. Also... dont wait until the end of her section to start your project... get it done fast and you will be thanking yourself later!
137782,3.5,3.0,QM2013,"Nov 29th, 2006", Yes,,,,,[],Knows what he's talking about if you can stand him enough to listen. Doesn't mind making students feel stupid in front of the rest of the class.
137782,4.0,4.0,STAT1,"Oct 25th, 2006", Yes,,,,,[],"He is really not all that bad once you get used to his personality. You need to be prepared for class, ask questions, and study plenty for his tests. I got an ""A"" and didn't feel that I had to do too much work. It's not easy, but it's not that hard!"
485624,5.0,4.0,BIOL1111,"Feb 18th, 2009", No,,,,,[],"Enviro Micro, very good teacher. She expects a lot but her tests are fair. Don't expect a free ride."
137782,3.5,5.0,STATSI,"Dec 16th, 2005",,,,,,[],"His class is pretty tough, but definitely doable to get a B...You'll have to work very hard to make an A. He is a good professor and tries to relate his class to real life...I enjoyed having him even though his class was hard...If you don't like him at first, give him a chance and I think you'll end up enjoying his class and what he has to say"
1273724,4.5,1.0,AS1001,"Dec 14th, 2014", No, Mandatory, A+,, Yes,[],Dr. Rivers is THE nicest guy. I've never seen him mad or upset. He'll treat everyone with respect and truly cares about his students. He's very helpful and makes coming to class fun. You just have to show up to pass this class.
485624,1.5,3.0,BIOL1003,"Aug 1st, 2007", No,,,,,[],Booooo-ring! Plants & Soceity is a class for non majors and it totally put me to sleep. The other class got to do fun things like go to a winery and the secret greenhouse on top of Oliphant while Levetin's class drooled on ourselves during powerpoints. And she always let us out of class early. But she is nice and cute and loves her fungi...
137782,1.0,5.0,2000,"Nov 20th, 2005",,,,,,[],HORRIBLE PROFESSOR! THE WORST YOU WILL EVER SEE OR IMAGINE! HE IS NOT A NICE PERSON AT ALL. I TOOK HIM YEARS AGO-HE NEEDS TO RETIRE AND STOP FAILING PEOPLE.
1273724,5.0,1.0,FLM2213,"Aug 14th, 2014", No,,,,,[],He is awesome. Sweetest guy you will ever meet and just really passionate about what he teaches. Definitely an easy A and worth taking just because he is so nice.
485624,1.0,4.0,BIOL,"Apr 12th, 2005",,,,,,[],"She tends to change projects at the last second, requiring a desperate scramble to finish successfully."
137782,3.0,4.0,STATIII,"Aug 18th, 2005",, Mandatory, A+,,,[],"He is hard... it is really easy to get a ""C"". If you are expecting an ""A"", you better be ready to put in the time."
485624,2.0,5.0,MEDBOTANY,"Jan 9th, 2005",,,,,,[],"I think it hurt that by the time the class started i was no longer a premed and have no innate interest in hearing about plants. Just a warning if you dont prepare, the night before will not help. NOT an exciting teacher."
137782,1.0,3.0,QM2013,"May 9th, 2005",,,,,,[],"May 9th, 2005"
485624,3.5,4.0,BIO1604,"Nov 30th, 2004",,,,,,[],"Dr. Levetin is a nice lady, but the material is difficult and not very interesting (she teaches the plants and fungi section of the course). Enjoy her half of the class though, because Dr. Reeder's half is a nightmare!"
137782,2.0,3.0,STAT,"Apr 11th, 2005",,,,,,[],He might be a cool guy...but he can be a big jerk and he is not a good professor! Prof. Urban is SO MUCH BETTER!!!!!
2011567,2.0,4.0,SOC3023,"Feb 14th, 2023", Yes,,,, Yes,"['TOUGH GRADER', 'GET READY TO READ']",Readings are dense. The professor doesn't try to work with you. Exams are difficult. You have to take the most detailed notes because he doesn't have any visual aids.
485624,3.5,3.0,BIO1604,"Nov 2nd, 2004",,,,,,[],"She's really nice, though her class is a little difficult. She teaches the first half and then the pain begins when Reeder teaches the second half."
137782,3.5,4.0,STATSI,"Apr 5th, 2005",,,,,,[],He's very intimidating although he is a nice guy and makes jokes in class. Always welcomes questions. Work between classes (not graded for pts). Class material is challenging. You can't sleep through this class and expect an A. Do the work and you'll do good.
2011567,4.0,3.0,SOC2133,"Apr 12th, 2022", Yes, Mandatory, A-, Yes, Yes,"['GET READY TO READ', 'PARTICIPATION MATTERS', 'LECTURE HEAVY']","Lecture orientated along with discussions over readings (multiple readings for every class period). No assignments, so your grade is based on exams/essays. His lectures mostly prepare you for exams, but only if you are actively listening and taking notes. Overall, he makes class engaging and he is passionate about the subject matter."
137782,1.5,3.0,STAT1AND2,"Mar 19th, 2005",,,,,,[],"Mar 19th, 2005"
137782,4.5,3.0,QM2013STAT,"Dec 20th, 2004",,,,,,[],"I really liked Professor Gebharts personality and the way he held class, worked problems, examples, etc. His tests are tough but he is very willing to work with you. You have to do your homework in his class."
2011567,2.0,5.0,SOC1033,"Nov 14th, 2019", Yes, Mandatory,, No, Yes,"[""SKIP CLASS? YOU WON'T PASS."", 'LECTURE HEAVY', 'TOUGH GRADER']",His notes don't really match up with his exams at all and he doesn't post powerpoints online so take detailed notes. He's hard to find duing office hours and doesnt help. The exams are hard to study for and makeup most of your grade. Just be prepared to study a lot and realize your study methods such as flashcards wont work on these test.
1274958,1.5,1.0,EE2163,"Apr 2nd, 2010", No,,,,,[],"Dr. Durham has added several requirements to this course, such as getting an FCC Amateur license, which are irrelevant to the students in this course. It's listed as EE, but only required for CS students. He contradicts the book, goes on long-winded rants about everything from his children to how to evade taxes. One of the worst teachers ever."
137782,5.0,4.0,QM202313,"Sep 21st, 2004",,,,,,[],"Excellent prof., have to seek help from him so he can help you out. Very willing to help anyone, the more I talked to him the more I understoond and learned. That is the key to his class. He is VERY fair, all 10 times I took him. Do your AIS early."
2011567,4.0,4.0,SOC1033,"Apr 27th, 2018", No, Mandatory, B, No, Yes,"['TOUGH GRADER', 'GRADED BY FEW THINGS', 'LECTURE HEAVY']","Lowe is a nice funny guy, but he expects a lot of a 1000-level course. Only grades were 2 essays a midterm and a final so it's hard to get your grade up. Grades pretty harshly on essays; classes are entirely lectures and he doesn't post the powerpoints so you have to take detailed notes the entire class. Not hard to pass, just hard to get an A"
137782,1.5,5.0,QM,"Sep 20th, 2004",,,,,,[],He is stubborn and at times mean. he tries to justify his teaching philosphy on a daily basis but fails miserably. Even the smartest kids in my class admitted they learned nothing.
1274958,4.5,1.0,ES3083,"Apr 20th, 2009", Yes,,,,,[],"Dr. Durham intentionally makes Econ an easy course, and provides a lot of useful economic insight outside of the book. HW isn't really graded; you just have to turn it in. Quizzes are basically a reward for attending class, and exams are open book and tell you exactly which example probs to follow. I look forward to having him in future EE courses."
137782,2.5,5.0,QMI,"Aug 27th, 2004",,,,,,[],Difficult class
2011567,5.0,4.0,SOC3023,"Jan 8th, 2017", Yes, Mandatory, B, Yes, Yes,"['GIVES GOOD FEEDBACK', 'GET READY TO READ', 'PARTICIPATION MATTERS']","Great professor, is able to explain things clearly, and can be reached easily. Be ready to read a lot and make sure you really understand the material and ask questions when you don't. You actually earn your grade in his class so don't expect to put in little effort and get an A."
137782,1.0,5.0,STAT,"Aug 27th, 2004",,,,,,[],This class sucks!
137782,2.0,5.0,STAT1001,"Mar 2nd, 2004",,,,,,[],Not very good at explanations at all. Have had some difficulty with things other than his personality in his class.
137782,4.0,3.0,QM12,"Dec 15th, 2003",,,,,,[],first day i was scared from getting an F in this course but at the end i found out that he is such a nice professor and will help you if you need help best to take these courses in Summer :)
549530,4.0,1.0,CPLT2813,"Jul 19th, 2022",, Mandatory,, Yes,,"['TOUGH GRADER', 'LOTS OF HOMEWORK', 'LECTURE HEAVY']","you basically have to write your own notes (which isn't too bad but he'll say ""make sure you write this down"" and if you miss it you're screwed) but the books you have to read are soooo boring but he says they are the best books he's every read. but make sure you either read the books or sparksnote it because every class you have to talk about it"
137782,5.0,3.0,STAT,"Jul 15th, 2003",,,,,,[],"You'll learn a lot as long as you try to understand the material, not just memorize it."
137782,4.0,2.0,STATS,"Apr 22nd, 2003",,,,,,[],If you can deal with his personality you'll learn a lot.
549530,1.0,5.0,CPLT2813,"May 4th, 2022", Yes, Not Mandatory, Not sure yet,, Yes,"['GET READY TO READ', 'LOTS OF HOMEWORK']",Seems like a nice dude but a truly awful professor with unreasonable expectations for a block 1 course. We had to read 6 whole books and two operas. It is difficult to keep up with the reading of books that are so obscure that there are no online summaries to be found. I've learned so little in this class but wasted so much time working on it.
1279785,5.0,1.0,FOUNDATIONSPSY,"Dec 14th, 2014", No, Not Mandatory, A+,, Yes,[],Super easy professor. Super sweet. She's very experienced and knows her stuff. The only downside to her is that she takes like 2 whole months to grade exams... Don't waste money on the textbook but you'll need the online access code which has the ebook.
549530,5.0,2.0,CPLT2813,"Apr 26th, 2022", Yes, Not Mandatory, B, Yes, Yes,"['GET READY TO READ', 'EXTRA CREDIT', 'CLEAR GRADING CRITERIA']","Professor Tingey is the best professor that I've had at TU so far. He's very understanding and will be willing to work with you if you're having trouble. He definitely cares about the students and is generous with grading. I'd definitely want to have him as my professor again. If you do the work, you'll do great!"
1279785,5.0,2.0,25301,"Apr 15th, 2014", Yes, Mandatory,,,,[],"She's hilarious! Awesome teacher, very bubbly."
1973200,5.0,2.0,1083,"Jan 27th, 2015", No,, A,, Yes,[],"He was genuinely excited to teach this class, and he was lenient when it came to grading papers. His tests are very easy because he gives you a sheet with everything you need to know on it a week in advance. He even invited the whole class to come get dinner with him to ask questions about an upcoming test, and he paid for dinner. He's a classy guy"
1279785,4.0,2.0,PSYCH2253,"Apr 30th, 2009", Yes,,,,,[],"Easy class, nice prof. If you do the test reviews and skim the textbook, you can make B's easily on the tests. Class attendance not required, but class is interesting, so it's worth going to."
549530,5.0,4.0,GERM4513,"Mar 8th, 2018", No, Mandatory, A, Yes, Yes,"['GIVES GOOD FEEDBACK', 'RESPECTED', 'ACCESSIBLE OUTSIDE CLASS']",Professor Tingey is one of my favorite profs at TU. He makes class discussion unintimidating and is pretty funny when you get to know him. Also he loves Star Wars & tries to tie it into class a lot. Very chill guy in upper level classes but stricter with 2000 level. Put in effort & he'll love you. I changed my minor to a major because of Tingey!
1973200,5.0,2.0,SACREDTEXTS,"Jan 7th, 2015", Yes,,,, Yes,[],"I really enjoyed this class, Professor Gungor made the lectures interesting and the tests and assignments were super easy as long as you showed up to class. I would definitely recommend taking this class and any class you can with him."
549530,4.0,3.0,CPLT2713,"Dec 5th, 2010", Yes,,,,,[],I took this as a block class and was hoping it wouldn't be too hard/too much work... if you're looking for an easy class: THIS IS NOT A BLOW OFF CLASS. It isn't too hard as long as you read the material and attend class but that is a lot of work... :/. But everything on the tests was covered in class at some point so that's nice... no curve balls!
1973200,5.0,2.0,SACREDTEXTS,"Jan 5th, 2015", Yes,,,, Yes,[],"He is really funny and cares a lot about his students. He assigns a lot of reading. I didn't read everything but still did well in the class. He is kind of repetitive in lectures, but they are still interesting and it is important to be in class. It is easy to get A's on his papers because they are opinion pieces. He also gives extra credit."
549530,4.5,1.0,CPLT2713,"Jan 15th, 2008", Yes,,,,,[],"Class was boring but easy. The second half we didn't spend enough time on the book but he still never asked questions on things he didn't go over repeatedly in class. Easy B if you don't read the book, easy A if you do."
549530,1.0,3.0,GERM4513,"Dec 14th, 2005",, Mandatory, A+,,,[],"A very nice guy with a genuine passion for the field; unfortunatly he has very little skill when it comes to teaching. Recommendation: Read the same texts on your own time. note: This is a 4000 level class, not a class on how to speak German. I am sure Dr.Tingey is more than capable when it comes to teaching German as a language."
549530,4.5,4.0,GERMAN1004,"Mar 20th, 2005",,,,,,[],"His class is demanding but he will work with all his sudents and you can tell he loves teaching, however it is a language class and if you fall behind it can be hard to get a good grade"
1301148,5.0,3.0,INTRO100,"Jul 8th, 2009", Yes,,,,,[],"Jul 8th, 2009"
1322794,1.0,4.0,MGMT01,"Dec 11th, 2018", Yes, Not Mandatory, C+, No, Yes,"['TOUGH GRADER', 'TEST HEAVY']","Dr. Laird is by far the toughest grader I have had in college. You have to know every word, definition, ""vivid example,"" etc. to get even the slightest bit of credit. Her tests are extremely detailed when it comes to essays and there is no direction regarding the tests. She did not make study guides until we asked. Overall, bad class and teacher."
2017142,5.0,3.0,MEB7023,"May 25th, 2017", Yes,, B+, Yes, Yes,"['GIVES GOOD FEEDBACK', 'ACCESSIBLE OUTSIDE CLASS', 'CARING']","Taught me how to think and communicate. Changed the way I look at life, perfect for this program"
