ID,Quality,Difficulty,Class_Name,Date_Taken,textbook,attendence,grade,take_again,credit,Tags,Comment
2188926,1.0,2.0,ART2263,"Mar 27th, 2019", No, Mandatory, A+, No, Yes,"['GROUP PROJECTS', 'TOUGH GRADER']","The essays are not so bad if you know how to use what he said in class and the example papers to write your own. Dont think its an easy-A, but if you go to class most of the time and draw every fountain he shows you (with notes), youll get an A. Just stay awake!"
2188926,1.0,1.0,ART1013,"Nov 7th, 2018", No, Mandatory, A, No, Yes,"['LOTS OF HOMEWORK', 'EXTRA CREDIT']","He requires you to do 2 sketches a day, but when he checks your sketchbook he doesn't have any clear grading criteria. Just slaps a grade on it regardless if you spent all night or just 5 minutes working on it. Usually just gives a good grade if he likes you. Also subtle racist remarks at the international students in my class once."
2188926,1.0,4.0,STUDIOART1,"Dec 13th, 2017", No, Mandatory, A+, No, Yes,"['PARTICIPATION MATTERS', ""SKIP CLASS? YOU WON'T PASS."", 'LOTS OF HOMEWORK']",BUSY WORK!! Get ready to spend a lot of time doing sketches! You have to make 2 a day EVERYDAY or you will fail the class. Even on the weekends! You have a project due pretty much every week on top of that and you have to critique it in front of the class. Its not hard but SO MUCH WORK to get an A! I spent more WAY time on this class than STAT.
1553412,4.0,4.0,HON2003,"May 4th, 2017", Yes, Mandatory, A, Yes, Yes,"['TOUGH GRADER', 'GET READY TO READ', 'ACCESSIBLE OUTSIDE CLASS']","Dutton's class is not easy, however, it is rewarding. I really enjoyed my semester with her and found her insight to be extremely helpful. Yet, just as some other reviews have suggested, she is often very vague and will leave you pages worth of comments on your papers. Don't be discouraged though! It is just her character. Hard, but a doable A."
2188926,3.0,4.0,FS197301,"Jun 17th, 2017", Yes, Mandatory, A, No, Yes,"['TOUGH GRADER', 'GET READY TO READ', 'PARTICIPATION MATTERS']","Would not recommend if you're just looking for a first seminar. 8 books are required for you to buy and I didn't need to read a single one to get an A, so that was a waste of money. He's very vague on what he wants, so ask a lot of questions. I would only recommend this course if you're into philosophy and storytelling."
1553412,5.0,5.0,HON2003,"Apr 26th, 2017", Yes, Mandatory,, Yes, Yes,"['TOUGH GRADER', 'GET READY TO READ', 'PARTICIPATION MATTERS']","She's tough, and not for the faint of heart, but she does so because she wants to see your flourish and become the best writer you can be. She wont grade you unfairly, but she wont be easy either. You have to really give it your best, and if you show her that you care and are genuine in your desire to learn, you should be okay."
655013,5.0,4.0,MUS0581,"Apr 27th, 2019", No, Mandatory, A, Yes, Yes,"['RESPECTED', 'INSPIRATIONAL', 'CARING']","Incredible. He cares about your growth as an artist and an individual. He is helpful and inspiring, and he is always eager to help with anything related or not to your performance skills. He is insanely talented as well - it is an honor and privilege to take from him. I'm no prodigy or piano major, but he cares for me as much as his other students."
2188926,3.0,4.0,ART2263,"Nov 9th, 2016", No,, B, No, Yes,"['GRADED BY FEW THINGS', 'EXTRA CREDIT', 'LECTURE HEAVY']","Class is very easy, right up until drop day. Very hard to get a handle on what he's looking for. You'll probably get a couple of rough grades until you figure him out, or the half of the class withdraws. Allows for a large amount of extra credit to get your grade back, but really makes you work for it."
1553412,1.0,5.0,HON2003,"May 23rd, 2016", Yes, Mandatory, B,, Yes,[],"Dutton is ridiculous in her expectation, no corrections or comments on papers yet received Bs. Tried to talk to her and understand exactly what she was expecting, but she was never specific or direct. I wish I had never enrolled in the honors program- Honors did not broadened my educational experiences has it claimed it would, but LOWERED my GPA."
655013,5.0,5.0,PIANO0583,"Apr 27th, 2011", Yes,,,,,[],Dr. Price is an incredible musician and an amazing teacher.He tailors his teaching style to whatever best suits individual students. As a piano teacher his focus on technique is to maintain relaxation while producing an amazing sound at the instrument.He is inspirational and constantly challenges his students to broader and deeper ways of thinking.
1553412,2.0,4.0,HON2003,"Apr 27th, 2016", Yes, Mandatory,,, Yes,[],"Professor Dutton is really nice, but is a little sporadic at times. It's hard to get a clear understanding of what she is expecting on papers. She's very smart, though, and definitely offers help whenever you ask."
655013,5.0,4.0,PIANOCOMP,"Oct 14th, 2005",,,,,,[],He makes everything very easy to understand and challenges me to think about everything I do as a musician and composer. I always walk out of his classes refreshed and inspired; I don't know what I'd do without Dr. Price!
655013,4.5,3.0,PIANO,"Sep 28th, 2005",,,,,,[],Dr. Price is my hero!!!!
2198373,5.0,3.0,CS2123,"Apr 16th, 2018", Yes, Mandatory, A, Yes, Yes,"['CLEAR GRADING CRITERIA', 'EXTRA CREDIT', 'LECTURE HEAVY']","Professor Girgis is an excellent instructor who stresses learning the material. His homework projects pertained to the content covered in the lectures, and he gave plenty of opportunity for extra credit throughout the semester. He generally grades projects and exams incredibly quick, sometimes even posting grades the same day they were due."
2198373,4.0,3.0,CS2123,"Apr 16th, 2018", No, Mandatory, A, Yes, Yes,"['ACCESSIBLE OUTSIDE CLASS', 'EXTRA CREDIT']","I'm not sure how he has gotten such a bad score. His lectures, at least for my class, were all handwritten and worked out in front of you. He made it very clear what he wanted in the tests and homework. Also, if you misunderstand something, he will re-explain the concept. sometimes he is not the best at explaining stuff, but I never felt lost"
2198373,3.0,2.0,CS3003,"Dec 30th, 2017", No, Mandatory, A, Yes, Yes,"[""SKIP CLASS? YOU WON'T PASS."", 'EXTRA CREDIT', 'TESTS ARE TOUGH']","The tests consist of questions straight from the slides, which can be a bit boring (especially the later ones). The projects can be finished if started early, and he extends them most of the times. I recommend taking this course when you have sufficient programming skills (sophomore-junior) in C/C++ and functional PLs or you will struggle."
2198373,1.0,5.0,CS3003,"Dec 19th, 2017", No, Mandatory, Not sure yet, No, Yes,['LOTS OF HOMEWORK'],"The course content is relatively boring, but the professor makes it extremely boring. Intends to force students to follow his idea. Poor slides, everything from textbook without rearrangement. Teaching a lot of languages I will never use anymore. Meaningless and ambiguous questions in test. You can learn everything by yourself in two weeks."
1560895,5.0,4.0,PSY2153,"Jul 21st, 2017", Yes, Mandatory,, Yes, Yes,"['GIVES GOOD FEEDBACK', 'PARTICIPATION MATTERS', 'INSPIRATIONAL']","I think Dr. Cromer is a great professor! She cares a lot about her students, and she is very passionate about what she teaches. If you respect her and come prepared to class, then she will give you the same amount of respect back. She can seem a little intimidating at first but just stick with it. I have learned so much from this class."
2198373,1.0,4.0,CS3003,"Nov 6th, 2017", No, Mandatory, A, No, Yes,"['TOUGH GRADER', 'LOTS OF HOMEWORK', 'BEWARE OF POP QUIZZES']",Very inconsistent professor. What's on the syllabus is not necessarily representative of what the class is. He has a bad habit of saying things wont be on the test when they actually are and giving unplanned lectures. He takes an abnormal amount of time to get grades back and makes it impossible to learn from mistakes by not returning your test.
1560895,2.0,4.0,DEVELOPEMENTAL,"Mar 29th, 2015", Yes,,,, Yes,[],I took developmental with this professor and it was overall an interesting class. The test questions were often ambiguous and definitely required reading the textbook. Class lectures often seemed to last a long time.
712891,3.0,4.0,SOC2023,"Apr 15th, 2019", Yes, Mandatory,, No, Yes,"['GET READY TO READ', 'HILARIOUS', 'BEWARE OF POP QUIZZES']",Dr. Jepperson is hilarious! Statistics is not very exciting but he did his best to make it interesting and engaging. You have to read A LOT for the pop quizzes and your grade for the class is almost solely based off of a midterm and a final. He does work with you if you need help but the class is pretty difficult.
1560895,3.5,2.0,PSY3063,"Aug 21st, 2013", Yes, Mandatory, B,,,[],"Unless Psychology is your favorite subject of all time and you're thinking about majoring in it, do not take classes with Cromer. Her lectures were dry and slow and usually ended up with her rambling about stories about her daughter or Canada. She prides herself on testing students on an Ivy League level which results in ambiguous test questions."
1560895,5.0,1.0,PSY2253,"Feb 5th, 2013", Yes,,,,,[],Great professor! Actually teaches!
712891,5.0,4.0,SOC4000,"Apr 8th, 2019", Yes, Mandatory,, Yes, Yes,"['RESPECTED', 'ACCESSIBLE OUTSIDE CLASS', 'PARTICIPATION MATTERS']","Dr. J is a well-respected, highly intelligent professor. You have to read, do a weekly reading quiz (just for him to judge though, not a part of your grade), and participate actively in discussion. He expects attentiveness from his students, but he is inspiring and very put-together in his lectures/materials. Highly recommend."
712891,5.0,4.0,FS1973,"Nov 6th, 2018", No, Mandatory, Not sure yet, Yes, Yes,"['GET READY TO READ', 'HILARIOUS', 'CARING']","Jepperson cares so much for his students and offers opportunities to meet with him and advising for the future. Any question will be answered in depth, and it is so easy to get into discussions with him. The course is interesting and he tries to engage the class. In order to pass, you gotta read, and he gives a quiz every other week. He is amazing."
712891,5.0,4.0,FS1973,"Jan 6th, 2017", Yes,, A, Yes, Yes,"['TOUGH GRADER', 'PARTICIPATION MATTERS', 'INSPIRATIONAL']","I LOVED THIS CLASS AND LOVE PROFESSOR JEPPERSON. Seriously. His teaching style, intellect, respect for his students and total honesty has made this class one I will never forget. You'll have to read, and participate in class, but the material is fascinating and Professor Jepperson welcomes all voices to participate in discussion. 10/10."
2208032,4.0,2.0,PSY3073,"Dec 9th, 2016", Yes, Mandatory, A, Yes, Yes,['EXTRA CREDIT'],"She has slides for each class that list the topics and she elaborates, so pay attention. The only way to keep up with everything is if you have a computer. Reading the material before lectures will keep you from getting behind as she does speak quickly. Extra credit opportunities before every test. The projects are easy. GREAT test prep."
712891,4.5,4.0,SOC496,"Jan 2nd, 2012", Yes,,,,,[],"Dr. Jepperson was the sociology undergraduate honors program advisor when I was enrolled at the University of Washington in 1994. As a mentor, he is outstanding. Based on his advice, I took a long break before getting my PhD (in Health Informatics). If you are not learning from Ron, you probably want to be led and need a more directed environment."
712891,5.0,4.0,SOC3000,"Jan 27th, 2011", Yes,,,,,[],"I took several sociology classes from Dr. Jepperson, and he is simply the best professor at TU. He is not easy, but he is reasonable, interesting, and he truly cares about his students."
143759,5.0,2.0,ES2513,"Dec 21st, 2019", No, Mandatory, A+, Yes, Yes,"['RESPECTED', 'PARTICIPATION MATTERS', 'CLEAR GRADING CRITERIA']","I took Professor Childress for Engineering Applications Programming, and I thoroughly enjoyed his class. I have never been good with programming or computers, but I did extremely well in this class thanks to his very good lectures and clear standards. Professor Childress is always happy to answer any questions you may have."
712891,5.0,5.0,SOC4123,"Oct 27th, 2009", Yes,,,,,[],Amazing. Tied only with Dr. Blocker for most amazing Prof. at TU.
143759,3.0,3.0,ES2513,"May 18th, 2019", No, Mandatory, A-, No, Yes,"[""SKIP CLASS? YOU WON'T PASS."", 'TOUGH GRADER']","Very stuck up and rude. Lectures helped a little bit, but it really came down to how well you could train yourself how to program. Quizzes and final were mostly based on examples and assignments from class. Really study for those, because some quizzes replace lab grades. Dont get too comfortable - there arent a lot of points to miss for an A."
712891,3.5,4.0,FS1973,"Aug 1st, 2007", No,,,,,[],"Lordy. This was the best class I have EVER. TAKEN. I recommend it with all my heart. Prof. Jepperson is really funny, totally on drugs, and truly cares about his students. Makes you work HARD and think even harder. Not afraid to call b.s. I got a lower grade than I thought I would but would retake the class in a heartbeat."
143759,1.0,4.0,ES2513,"May 8th, 2019", No, Mandatory, A-, No, Yes,"[""SKIP CLASS? YOU WON'T PASS."", 'LECTURE HEAVY', 'TOUGH GRADER']",He was rude and honestly acted entitled in class. Like we were there for his pleasure and that we didnt matter at all. When you asked him for help he seemed to be put off by it. Not a good teacher in my opinion
1570331,5.0,1.0,BUS1013,"Jul 29th, 2017", Yes, Mandatory, A+, Yes, Yes,"['GET READY TO READ', 'HILARIOUS', 'AMAZING LECTURES']","Dr. Zboja is hilarious, and he makes lectures super fun and interesting. He is very interactive and enjoys showing a lot of videos in class. The reading is time consuming, but if you're willing to put in the work, it'll be easy."
712891,1.0,3.0,SOCST0000,"Dec 18th, 2006", Yes,,,,,[],"Jepperson grades subjectively which I guess is fine, because it is social statistics, but he is not consistent in his grading (what is fine on one students paper is not fine on anothers). The final is a cumulitive test and is worth a whopping 60%. This class is not so much about learning the subject matter, but rather what jepperson wants at tha"
143759,4.0,2.0,ES2513,"Apr 1st, 2019", No, Mandatory, Not sure yet, Yes, Yes,"[""SKIP CLASS? YOU WON'T PASS."", 'GRADED BY FEW THINGS', 'BEWARE OF POP QUIZZES']","Class wasn't hard and he is a good professor. They have books required for the class for required reading, didn't need them. Some of the labs can be hard to follow so would suggest having a friend in the class. Good lectures"
712891,1.0,5.0,SOC,"Nov 9th, 2005",,,,,,[],Ron your the kewlest guy i know... thanks for everything... And even tho we didnt see eye to eye on a lot of things... every once in a while your would step up on the stairs and we would.
1570331,5.0,2.0,MGKT3003,"Aug 10th, 2016", No, Not Mandatory, A, Yes, Yes,"['TOUGH GRADER', 'CARES ABOUT STUDENTS', 'PARTICIPATION MATTERS']","Great teacher and super interesting but then his tests were like crazy hard (harder than they should be, definitely passable though). I would take him again"
712891,5.0,4.0,SOC,"Oct 23rd, 2005",,,,,,[],This guy is an amazing professor. He is inspirational and challenging. I recommend to anyone attending TU who is serious about their education to take a class from him.
143759,1.0,3.0,ES2513,"Dec 12th, 2018", No, Mandatory, Not sure yet, No, Yes,"['TOUGH GRADER', ""SKIP CLASS? YOU WON'T PASS."", 'BEWARE OF POP QUIZZES']","Mr. Childress is by far the worst professor I have had in my two and half years in TU. His lectures are monotonic and incredibly boring, quizzes are unannounced although you can find a pattern that he skips a week for the quizzes. I found that he is incredibly rude with students and isn't very helpful in lab! most of the time the TA had to help me."
1570331,5.0,3.0,MGKT3003,"Jun 24th, 2016", Yes,, A, Yes, Yes,[],"amazing,fun i enjoyed every single day"
712891,4.5,4.0,4000,"Sep 8th, 2005",,,,,,[],"Sep 8th, 2005"
143759,4.0,3.0,ES2513,"May 5th, 2017", No, Mandatory, A, Yes, Yes,"['GIVES GOOD FEEDBACK', 'PARTICIPATION MATTERS', 'CLEAR GRADING CRITERIA']","Lectures are incredibly boring, but he covers the material that he assesses. Work is very repetitive and basic. Easy A though."
1570331,4.0,2.0,MGKT3003,"Jan 13th, 2014", No,,,,,[],Nice and easy class. Just print the slides from Harvey and study those instead of reading the textbook and you will do great on the exams. His exams are pretty easy and come from the lectures (slides).
712891,2.5,4.0,STAT2013,"Apr 18th, 2004",,,,,,[],"Apr 18th, 2004"
2208121,4.0,3.0,CS4503,"Mar 21st, 2022", N/A, Not Mandatory, A, Yes, Yes,"['PARTICIPATION MATTERS', 'RESPECTED']",Dr. Kuttal is very knowledgeable but cannot always articulate what she wants to easily. This does not detract from how well she teaches. The research papers she presents are sometimes long-winded but she does well at explaining their contents thoroughly.
1570331,4.5,2.0,MKTG4043,"Apr 28th, 2011", No,,,,,[],Funniest most laid back teacher on campus. Will help you with whatever you need. uses alot of video examples in class
143759,4.0,3.0,ES2513,"Apr 26th, 2017", No, Mandatory, A, Yes, Yes,"['RESPECTED', 'PARTICIPATION MATTERS', 'BEWARE OF POP QUIZZES']",If you pay attention and respect him then you'll do fine in this class.
2208121,3.0,3.0,CS7863,"Apr 21st, 2020", No,, A, Yes, Yes,"['GET READY TO READ', 'CARING']","The User Centered Design & Research class was a lot of reading, reviewing research papers, and discussion. It's good exposure to the research process, especially being a new grad student. However, grading and feedback was not always clear, and the lectures were unorganized/sloppy. Material also seemed outdated, but she is interesting to talk to."
143759,5.0,3.0,CS3353,"Oct 23rd, 2014", Yes, Mandatory, Not sure yet,, Yes,[],"Childress has tons of experience in the industry and has a kind of charming character. His expectations are crystal clear, but is also very understanding if you go and talk to him. Highly recommended!"
2208121,1.0,4.0,CS2003,"Mar 26th, 2018", No,, B, No, Yes,"['TOUGH GRADER', 'GET READY TO READ', 'LECTURE HEAVY']","During her lectures, she has no idea what she is talking about. She will try to start an example and will have no idea how to finish it. The tests have the worst grading scale to where 2 of the few questions are worth 40% of the entire test, and they are usually problems you will have no idea how to do. She does not teach at all."
143759,3.5,3.0,CS1043,"Oct 20th, 2014", No, Mandatory, A-,, Yes,[],"Childress is very soft spoken, but explains Java pretty well. I'd never taken a programming course before and I did pretty well. You do have to study quite a bit for his tests, but that's expected. He gives unannounced in-class assignments, so you should probably show up to class."
2208121,2.0,3.0,CS4503,"Nov 28th, 2017", No, Not Mandatory, A, No, Yes,"['ACCESSIBLE OUTSIDE CLASS', 'GRADED BY FEW THINGS', 'CARING']","Dr. Kuttal may be the worst lecturer in the TU CS dept. She is poorly organized and does not communicate concepts well. Her test questions are very confusing and seem to come from a very dated interview prep site. Wording on exams is very odd/confusing. However she is kind, and she will work with students if you come to her during office hours."
143759,5.0,3.0,CS1043,"Nov 7th, 2012", No,,,,,[],"The class wasn't that easy for me, because I had never taken a programming course or even thought about it in my life, but Childress is great at telling you his expectations and is very clear about what is going on in the course. Also, there is a certain charm that he brings to the class if you're there long enough."
143759,5.0,2.0,CS1043,"Oct 25th, 2011", No,,,,,[],"Oct 25th, 2011"
143759,5.0,3.0,CS2503,"Jul 19th, 2010", No,,,,,[],"I knew absolutely nothing about computers prior to his class, scientific programming, so that class was to me difficult, but his presentation of the material is clear and I ended up with an A. The corse is structured well and well taught. Very intelligent and can adequately answer your questions. Labs are lengthy. I highly recommend the course."
143759,3.5,3.0,CS1043,"Mar 20th, 2010", Yes,,,,,[],normal hardness and clear notes and his exam guide are pretty much the same as his exams
720995,5.0,4.0,CHEM3013,"Jan 9th, 2011", Yes,,,,,[],"Probably the best teacher I've ever had. The course material is very tough at times and it's easy to get confused, but he's SO helpful outside of class. Tests are tough, but not impossible. Do NOT get behind, very difficult to catch back up."
143759,5.0,1.0,INTROJAVA,"May 6th, 2009", Yes,,,,,[],"This guy is great. His voice reminds of Paul Giamatti seriously could never focus on class because I was always thinking of that movie SideWays... anyway... this guys tests are eaaaaazy straight from reviews. Labs are a sinch if you put the effort. He will always help you. People, you gotta put in the time and work hard, you will do fine!"
720995,5.0,3.0,CHEM3023,"Mar 6th, 2010", Yes,,,,,[],"Dr. Baures is seriously one of the nicest people alive. He is BY FAR the best teacher I have ever had. He made a terrifying subject (O Chem) interesting and easy to learn. He is always willing to help, you know exactly the kinds of questions that will be on the tests, and his teaching style is both calming and entertaining. Best professor EVER!"
2209420,4.0,3.0,ME2023,"May 6th, 2020", No, Mandatory, Not sure yet, Yes, Yes,"[""SKIP CLASS? YOU WON'T PASS."", 'HILARIOUS', 'CARING']","Pro: I heard horror stories about this class but this professor makes it so much better. He is funny and lectures in a way the students understand. Con: Takes forever to grade and return grades. Takes about three weeks, I turned my final in before my last exam was graded."
143759,3.0,3.0,CS1043,"Apr 7th, 2009", No,,,,,[],"He knows he's stuff, and teaches it well. If it's your first time in a CS class it will be a bit confusing but thats expected being that its a whole new world of knowledge. If you take other CS classes later alot of the stuff he says will start to make since. 1043 is a basics class and in CS if you only know the basics it still seems confusing."
1671117,3.0,4.0,MBA7063,"Dec 17th, 2019", No, Mandatory, B, No, Yes,"['GET READY TO READ', 'PARTICIPATION MATTERS', 'TOUGH GRADER']","He requires a lot of participation, but not just saying things youve read, you have to dig deep. His classes might be a challenge for those who are more quiet, but if you try you will at least make it out with a B."
720995,4.5,3.0,CHEM3013,"Mar 2nd, 2010", Yes,,,,,[],"Very helpful, and his class is challenging but manageable if you study. The previous tests really helped me to prepare."
143759,4.5,3.0,CS1043,"Jun 5th, 2008", No,,,,,[],"he will do what every he can to help the student, thats cool! his exams are fair"
1671117,1.0,5.0,MGT3003,"Oct 7th, 2019", Yes, Mandatory, C, No, Yes,[],Marches into class and demands people participate. If we don't he gets mad. Locks doors early and humiliates people who are late. Can't concentrate for the tests.
143759,3.5,3.0,CS3353,"Apr 1st, 2008", Yes,,,,,[],"The tests aren't too hard, there was a lot of note taking in class, but a lot of that info is just in the book. He's a bit more fun and interesting in the higher up classes. He's really helpful if you email him or talk to him outside of class."
720995,4.5,2.0,ORGCHEM,"May 6th, 2009", Yes,,,,,[],"thinking back, Baures was a nice guy who helped me a lot (a rarity in the TU chem department). He never had an attitude of superiority and never puts you down. It's not so much he is hard but the material (Org II) is hard. Buy the text and solutions manual, do EVERY problem relentlessly, work hard and dont give up, you will be all right!"
143759,2.0,4.0,JAVAPROGR,"Mar 30th, 2006",,,,,,[],Absolutely no class participation...very boring. He constantly jumps around on the chalk board which makes it hard to make understandable notes. Take somebody else.
1671117,5.0,2.0,MGT3003,"Sep 26th, 2019", No, Mandatory, A+, Yes, Yes,"['RESPECTED', 'AMAZING LECTURES', 'CARING']",I love this guy and he has probably been my fav professor so far. He's really nice and funny and seems to really care about his students. Take his classes!!
720995,4.0,4.0,OCHEM2023,"Nov 5th, 2008", Yes,,,,,[],"Organic chem I wasn't too bad for me, but expect to study. I did all the recommended problems, read every chapter (doing examples within the chapter as well), and went to all the review sessions. Organic chem II was actually the first B of my life (also with Baures), although i stopped going to class and started studying on my own. Youre gonnawor"
143759,1.0,5.0,CS1043,"Nov 7th, 2005",,,,,,[],i went in several times before class for help and before test he turned me away and said i would get the average grade yeah hello C horrible teacher
1671117,5.0,4.0,GLS2023,"May 1st, 2019", Yes, Mandatory, A, Yes, Yes,"['ACCESSIBLE OUTSIDE CLASS', 'PARTICIPATION MATTERS', 'CLEAR GRADING CRITERIA']","Dr. Troilo is one of the best professors I have ever had. He cares so much about the success of his students and is very helpful in and out of class in helping students understand the subject matter. The case studies are hard work, but they were so beneficial to participating in the discussion, even for someone like me who does not enjoy that."
143759,3.5,3.0,CS1043,"Oct 24th, 2005",,,,,,[],kind of boring but his lectures are fairly clear. Manageable difficulty even if you don't know anything about computers
143759,1.0,5.0,CS1043,"Oct 24th, 2004",,,,,,[],"Don't take this class if you haven't had prior programming experience, because the basics are non-existent in this class!!!"
