ID,Quality,Difficulty,Class_Name,Date_Taken,textbook,attendence,grade,take_again,credit,Tags,Comment
216516,5.0,3.0,MGT,"Oct 31st, 2003",,,,,,[],I loved his class. I learned so much! The good thing about Dr. Rasher is that he has actually been in the real world and knows what he is teaching! Great guy!
216516,2.5,5.0,BUSINSOC,"Aug 8th, 2003",,,,,,[],"Aug 8th, 2003"
216516,5.0,2.0,MGT3003,"Jul 15th, 2003",,,,,,[],"i love rasher, he's awesome! i had him for a prior class, and when i saw he was available in the management course i needed, i made sure his class fit my schedule."
216516,5.0,3.0,MGMT,"Jul 15th, 2003",,,,,,[],Excellent instructor. Very fair.
984435,4.0,4.0,FIN4033,"Apr 22nd, 2016", Yes, Not Mandatory, B+,, Yes,[],I thought classes where difficult and test were extremely hard. That said there is a curve. I think Larry is a great professor but his classes can be intimidating.
984435,1.0,3.0,FIN4033,"May 5th, 2013", Yes,,,,,[],"Might be the most boring professor I've ever had. Curves the entire class, but grading is questionable (you can complete the test and receive a lower grade than a person who only completed half). Study for 10 hours or 1 and understand the same amount of material. I'll be glad to be finished with this class."
984435,2.5,3.0,FIN3083,"Jun 21st, 2010", Yes,,,,,[],"An average class day consisted of about 30% of the class showing up, 2% paying attention, and Big Larry discussing fantasy baseball and staring out the window. All in all he's a great guy, but better suited teaching grad classes than undergrad."
984435,3.5,2.0,FIN3083,"Jun 21st, 2010", No,,,,,[],I don't think any one person actually passed a single one of Big Larry's tests. However he used an extensive curve. Tests are really hard open note open book but when there is a 40% curve the class almost becomes laughable.
984435,4.5,3.0,FIN7003,"Sep 3rd, 2008", Yes,,,,,[],Great guy....hard tests but very fair.
984435,4.0,2.0,FIN4033,"Apr 29th, 2007", Yes,,,,,[],"Prof. is a nice guy but is very mathematical. Uses excel excessavely. Tests are open book, notes, handouts etc. Was a good class."
985009,5.0,2.0,EDUC3103,"Dec 6th, 2013", Yes,,,,,[],"This was my favorite class ever! You design lessons around books and most of your grade comes from these projects, which are really fun! There were even students in my class who weren't Ed. majors who loved it and did well too! She always brings snacks to class and is just the sweetest. Couldn't recommend her more!"
985009,5.0,2.0,EDUC2303,"Apr 28th, 2009", No,,,,,[],"Mrs. Avery is the SO SWEET. She is the nicest lady you'll ever meet, she is an elementary teacher herself so she knows what she's talking about. Her class is really easy and a lot fun. It's hard NOT to get an A."
985538,5.0,3.0,CONSTII,"Apr 23rd, 2023", Yes, Mandatory, A, Yes, Yes,"['RESPECTED', 'LECTURE HEAVY', 'GRADED BY FEW THINGS']",Professor Entzeroth is a fantastic professor. Her classes do not allow laptops which really helps you absorb the material. Her exams are time stressed but totally doable. She pulls exam essay topics from current cases before the supreme court which makes things super interesting. I highly recommend her classes.
985538,5.0,4.0,LAW5712,"Mar 17th, 2018", Yes, Mandatory, A-, Yes, Yes,"['RESPECTED', 'PARTICIPATION MATTERS', 'AMAZING LECTURES']","She is absolutely an awesome professor of Constitutional Law. Her knowledge and enthusiasm are contagious. I wish she would teach Con Law II. Fabulous professor, plus she's a great person, too."
985538,4.5,4.0,LAW1,"Apr 16th, 2012", Yes,,,,,[],"Apr 16th, 2012"
985538,5.0,2.0,CONSTII,"Nov 8th, 2008", Yes,,,,,[],Prof. Entzeroth is great. I've had her twice now. Her teaching is so clear to understand. I hope everybody can take her class at least once.
1017297,4.0,4.0,ENGL1013,"Nov 17th, 2012", Yes,,,,,[],"Ms. Trevathan is really interesting and funny. She is a little disorganized, but I think anyone would be in that situation. She seems to enjoy what she does, she's always very approachable as far as questions go. She's not too hard, but not too easy either. I'd take her again."
1017297,5.0,3.0,ENGL1033,"Nov 17th, 2012", Yes,,,,,[],Ms. Trevathan is awesome; she's funny and cares a lot about her students.
1026133,4.5,2.0,ENG1213,"Nov 6th, 2013", Yes,,,,,[],Loved this professor. She was insightful and very helpful. Class discussions were vital to class and she kept them interesting and made think and support your thoughts. I definitely WOULD recommend to anyone looking for a good Comp II professor.
1026133,5.0,1.0,ENG1004,"Apr 13th, 2013", No,,,,,[],I really really and really love her because she likes her students and tries to help them ASAS. I advice you guys to take the class with her without thinking about the grade that you will get at the end of the semester.... THANKS MY PROFESSOR FOREVER.
1026133,3.5,1.0,ENGL3003,"Mar 25th, 2010", Yes,,,,,[],"She was an average teacher To the haters, all I can say is: COME ON GUYS. We aren't English majors and she made the class as easy and painless as possible. Thank you so much Spring!"
1026133,4.5,3.0,ENG3003,"Jan 30th, 2010", Yes,,,,,[],Clear and straight-forward. Interesting discussions!
1026133,2.5,1.0,ENG1043,"Sep 7th, 2007", Yes,,,,,[],"Sep 7th, 2007"
1035011,5.0,3.0,MGT3003,"Nov 4th, 2019", Yes, Mandatory, A, Yes, Yes,"[""SKIP CLASS? YOU WON'T PASS."", 'GRADED BY FEW THINGS', 'CARING']","His tests are material from his lectures, the text, and news briefs given by students. Go to class because he might discuss something important that isn't in the text or the slides. Tests feel a little like the lottery, there's a lot of material, and only so many questions. He's nice and understanding though. Always willing to answer questions."
1035011,5.0,3.0,MGT3003,"Dec 21st, 2018", Yes, Mandatory, A, Yes, Yes,"['RESPECTED', 'CARING', 'LECTURE HEAVY']",Senese is a great guy. I just finished my first class with him. He is very respectful to students and respected in turn by them. His class style is slightly boring because he covers the material very slowly. This is helpful though for the many students at TU that use English as a second language. There is some class discussion but mostly lecture.
1035011,2.0,4.0,MGT3003,"Oct 31st, 2018", Yes, Mandatory, B, No, Yes,"['TOUGH GRADER', 'PARTICIPATION MATTERS', ""SKIP CLASS? YOU WON'T PASS.""]","Very nice man but his teaching style is questionable. He will contradict the book often. A 30 question test is 200 points; MC questions are 6-7 pts and short answer are 9 . His study guides aren't helpful, and his criteria for projects is unclear. You can study for hours and still fail because his tests cover so little of the total material."
1035011,5.0,3.0,MGT3003,"Jun 27th, 2017", Yes, Not Mandatory, A, Yes, Yes,"['RESPECTED', 'PARTICIPATION MATTERS', 'AMAZING LECTURES']","Great class! Take notes and engage during class and you will do well. He gives great study guides, if you follow them you'll do well on the exam. He provides great real world examples that help connect the academic knowledge to business skills."
1035011,5.0,2.0,MGT3003,"Jun 25th, 2014", Yes, Mandatory,,,,[],Finally! A Professor that has 40 years of experience actually working in industry and management instead of an academic that was never in the real business world. Dr. Senese will tell you what it is and give real world or personal examples.
1035011,5.0,2.0,MGT4073,"Mar 5th, 2013", Yes,,,,,[],"Great professor! Seems to really care about his students. Has a lot of real world experience, which is nice."
1035011,4.5,5.0,MGT4073,"Dec 14th, 2012", Yes,,,,,[],A Professor with actually real world experience... You don't learn from a textbook you learn from Professor Senese's 30 years in the corporate world. Hard but good.
1035011,2.0,3.0,MGMT3003,"Nov 30th, 2009", No,,,,,[],Great in terms of lectures. Keeps you interested with examples. The bad thing is that his tests are very difficult because he contradicts his lectures. His lectures sometimes contradict the book as well. Very difficult to get an A on his exams. Management should be more straight forward.
1035011,4.5,1.0,BUS1013,"Dec 23rd, 2008", No,,,,,[],"Good teacher, clearly explains his topic. Just take GOOD notes (tests are ALL about his lectures) and read the book a little bit and you'll get an ""A."""
1035011,5.0,4.0,MGT3003,"Jan 4th, 2008", Yes,,,,,[],"loved this class, hard class but usefull"
1035011,5.0,5.0,MGT3003,"Oct 4th, 2007", Yes,,,,,[],"Oct 4th, 2007"
1038485,4.0,2.0,ANTH1063,"Oct 20th, 2016", No,,, Yes, Yes,"[""SKIP CLASS? YOU WON'T PASS."", 'GRADED BY FEW THINGS', 'AMAZING LECTURES']","His lectures are easy to understand and aren't boring. The tests are based off what he talks about in class, and the ""Textbook"" is only $4 on amazon if you want it, but you don't need it. He gives review sheets, and if you need help you can email or ask him. The tests are fairly simple if you studied."
1038485,4.0,4.0,ANTH2033,"Apr 17th, 2016", Yes, Not Mandatory, A,, Yes,[],"I love Dr Whalen, which is funny because when I asked him once if I could intellectually hack the program at a prestigious university, he said I had at least the minimum abilities! But I appreciate his honesty. Brilliant man, one of the best profs I've ever had. I still think about things he taught me 15 years ago."
1038485,5.0,3.0,7233,"Dec 13th, 2014", Yes,,,, Yes,[],"I really like the teaching methods of Dr. Whalen, but is not going to be a easy class."
1038485,4.5,3.0,ANTH7233,"Apr 20th, 2012", Yes,,,,,[],Wonderful Prof. Extremely knowledgeble. Always helpful. Everytime I visited him in his office he was busy but would always take the time to help me and answer all of my questions. Very funny and quirky.
1038485,2.0,3.0,ANTH3133,"Feb 29th, 2012", Yes,,,,,[],Don't take classes from him unless required. Arrogant. Talks down to students. Grades are anyone's guess. Don't ask questions in class. He hates being interrupted. Doesn't like to be bothered in his office. Don't miss any classes. He will lower your grade.
1038485,5.0,2.0,ANTH3133,"Nov 1st, 2011", Yes,,,,,[],"Took 2 classes with Whalen. I really really enjoyed his classes. His lecture is interesting and his tests are pretty easy. Couple of papers due, but almost all of them were interesting reads/writes. I was actually excited to go to his classes. He's pretty funny when he imitates apes in the classroom. Took 2 and would take more with him"
1038485,3.5,5.0,ANTHARCH,"Oct 8th, 2010", Yes,,,,,[],"He's knowledgeable and clear in teaching. Don't take his classes if not your major. Attendance isn't mandatory but absences are reflected in grades. Doesn't like being disturbed outside of class, but will assist. Lacks interpersonal skills. Unfortunately, grades with bias. If he likes you, great. If not, too bad. You won't change his opinion."
1038485,5.0,4.0,ANTH4513,"Sep 3rd, 2008", Yes,,,,,[],I wish more teachers were like him.
1038485,4.0,3.0,ANTH2033,"Oct 15th, 2007", No,,,,,[],"I adore Whalen. He is a hard professor who has a bad tendency to lecture ""at"" students but he tries very hard to keep the classroom fun. He tells interesting and relevant stories. He's a hard but fair grader. He is also very passionate about what he does and what he teaches. Although, I wouldn't recommend him if you're not an anthropology major."
1039332,4.5,3.0,EMGT2013,"Apr 3rd, 2013", No,,,,,[],"Everyone says how brutal Teds class is, but i loved it. If your read the pioneers twice the quizzes are so easy and if you review a couple days for the prize its not to bad. I made an A, and Ted never lectures but he allows guest speakers to come in from around the US to discuss current events and topics. i personally thought it was a great class"
1039332,3.5,3.0,EMGT2013,"Apr 3rd, 2013", No,,,,,[],"I was nervous before taking this class, cause i heard it was brutal... but in reality it was a great class!!! sure Ted never personally lectures, but he brings in guest speakers and let them discuss interesting topics! if you read and review a little bit you can make an A Also quizzes are super easy if u read over the pioneers once or twice."
1039332,5.0,3.0,EMGT,"Mar 5th, 2013", Yes,,,,,[],"I won't comment on Ted's teaching. He is a mentor and arguably the best academic advisor at TU with respect to how hard he works for his students. He sets high standards, but if you are in the program, that is to be expected. He can help you get a job and has brought more scholarship money to the university more than any one person. Ted is great."
1039332,3.0,4.0,EM2013,"Dec 10th, 2011", Yes,,,,,[],"Be prepared to read The Prize. The midterm and final were each comprised of about 180 questions each taken solely from The Prize. We never discussed the book in class. Be prepared for weekly quizzes. Ted never lectures, guest lecturer every week. Ridiculous, but interesting, class."
1039796,1.0,5.0,CONSUMERBEHAVI,"May 18th, 2014", No, Mandatory, F,,,[],Attendance: Mandatory
1039796,2.0,4.0,MKTG3033,"Jul 31st, 2008", No,,,,,[],everybody fails the tests but make outs ok in the class
1039796,1.0,5.0,MARK3001,"Apr 28th, 2008", No,,,,,[],"Reviewed: Jul 2nd, 2008"
1039796,2.0,5.0,MRKT3013,"Oct 18th, 2007", Yes,,,,,[],"Oct 18th, 2007"
1044255,3.0,3.0,MATH1163,"Dec 30th, 2018", Yes, Mandatory,, Yes, Yes,"['GIVES GOOD FEEDBACK', ""SKIP CLASS? YOU WON'T PASS."", 'CLEAR GRADING CRITERIA']","This professor expects you to learn a lot on your own. She will go over everything you need to know, but only briefly, and outside preparation is necessary to do well on the quizzes. If you have never taken precalculus before, I would seek help during office hours because otherwise it would be very difficult to grasp the topics quickly."
1044255,4.0,5.0,MATH2024,"Jul 13th, 2009", Yes,,,,,[],"She is tough, but she'll do her best to help you understand. She appreciates it if you try to be involved..answer questions, look like you're paying attention, etc. Don't expect to turn in your homework and leave, or leave right after your quiz..she doesn't like that."
1044255,3.0,5.0,MATH2024,"Mar 1st, 2009", Yes,,,,,[],"Yes, indeed, she has been endowed the title of Miss Oklahoma... With that out of the way, either you love her or you hate her. She has an attitude towards struggling students (or lazy). She expects you to be a self-taught learner. She does NOT teach the stuff. So avoid her if you aren't the ""best student."" She gives quizzes immediately. No review!"
1044255,4.5,4.0,CALC1,"Oct 27th, 2007", Yes,,,,,[],"Reviewed: Aug 12th, 2010"
1051884,2.5,3.0,CONTRACTS,"May 6th, 2015", Yes,, B,, Yes,[],"Agree with other commenters - talked more about sports, family and jeopardy than anything else. Hard to follow as these tangents come in the middle of talking about substantive contract matters. Did NOT enjoy class in the least. Learned all I know about contracts from the outlines and the bar review materials I studied after graduation."
1051884,2.0,4.0,CONTRACTS,"Aug 29th, 2014", No, Mandatory, C,,,[],"Often went off course. More interested in talking about sports, her family, television and books, and her experience on Jeopardy. Very egotistical but not impressive at all."
1051884,1.0,2.0,CON1,"Jan 6th, 2009", No,,,,,[],Worst teacher I have ever had.
1051884,2.0,3.0,WS2013,"Apr 20th, 2008", Yes,,,,,[],"I felt personally insulted by her on multiple occasions. She expresses little if any concern for students' opinions and will often ignore students who have their hands raised or will interrupt students. Loved the class, don't care for her at all."
230643,5.0,4.0,CHEM1013,"Dec 14th, 2022", Yes, Not Mandatory, A, Yes, Yes,"['EXTRA CREDIT', 'AMAZING LECTURES', 'TEST HEAVY']","Great lecturer, difficult tests, and decent amount of extra credit available if you consistently attend office hours."
230643,1.0,5.0,CHEM1013,"Mar 31st, 2022", N/A, Not Mandatory, Drop/Withdrawal,, Yes,"['TOUGH GRADER', 'AMAZING LECTURES', 'LECTURE HEAVY']","Dr. Purser is the definition of frat boy who never grew up. I had this class the fall of 2021 as a freshman, and to put it bluntly take from any other chem professor at TU but him. Purser is an amazing lecturing, and makes them extremely fun and interesting, but his tests are UNGODLY hard and impossible unless you are extremely gifted in science."
230643,5.0,4.0,CHEM1013,"Dec 25th, 2021", Yes, Not Mandatory, A, Yes, Yes,"[""SKIP CLASS? YOU WON'T PASS."", 'GRADED BY FEW THINGS', 'TEST HEAVY']","I really liked having Purser, he is clearly passionate about the material and his lectures are engaging. But the class is pretty difficult and mostly consists of tests. He did offer some extra credit opportunities which were nice and helped my grade a lot. If you take this class be sure to go to office hours, you'll need it!!"
230643,2.0,5.0,CHEM1013,"Dec 22nd, 2021", Yes, Not Mandatory, C, Yes, Yes,"[""SKIP CLASS? YOU WON'T PASS."", 'TEST HEAVY', 'AMAZING LECTURES']","Pursuer told me in office hours one day that his class isn't a weed-out class. The girl that came in and broke down in tears looking over her test portrayed quite the contrary. Pursuer is a fantastic lecturer. Unfortunately, his tests are ungodly hard and I got a C despite 2 years of chemistry in HS. Be prepared to do your own HW and reading."
230643,2.0,5.0,CHEM1013,"Apr 20th, 2020", Yes, Not Mandatory, C, No, Yes,"[""SKIP CLASS? YOU WON'T PASS."", 'GRADED BY FEW THINGS', 'TEST HEAVY']",The hardest instructor for gen chem on campus. Would not recommend. Killed my gpa.
230643,2.0,4.0,CHEM1013,"Sep 17th, 2019", Yes, Not Mandatory,, No, Yes,"['TEST HEAVY', 'TOUGH GRADER']","His exams are EXTREMELY difficult. He hands them back in order from lowest grade to highest grade. Do NOT keep him as a professor if you havent taken chemistry or have little knowledge about chemistry. I thought I knew a lot about chemistry, but he made it clear that I didnt."
230643,5.0,1.0,CHEM2024,"Oct 17th, 2018", No, Mandatory, A, Yes, Yes,"['RESPECTED', 'CLEAR GRADING CRITERIA', 'AMAZING LECTURES']","This review is ONLY for his Energy Tech for the Future class . This class is THE MOST INTERESTING class I have had at TU. As long as you are taking Energy Tech and not Chem Tech, you don't have any exams and your grade is mostly based on open note quizzes. This class is an easy A and SUPER interesting."
230643,3.0,5.0,CHEM1013,"Mar 10th, 2018", No, Not Mandatory, C, No, Yes,"['TOUGH GRADER', ""SKIP CLASS? YOU WON'T PASS."", 'LECTURE HEAVY']",Purser is very knowledgable and quite engaging in his lecturers. He's extremely demeaning. The tests are difficult and when passing them back he announces the highest & lowest grades then passes them back in order from lowest to highest. He curves the final class grade but doesn't announce that until after the drop date (mine curved at least 10%).
230643,3.0,5.0,CHEM1013,"Mar 2nd, 2018", Yes, Not Mandatory, B, No, Yes,"['TOUGH GRADER', ""SKIP CLASS? YOU WON'T PASS."", 'TEST HEAVY']","Very intelligent and knowledgeable about Chemistry. Exams are very difficult and sometimes require you to do additional reading from the textbook. Gives a decent curve at the end of the semester, so thats a great incentive to try and survive. And excellent choice to actually learn the material, but it comes with the gamble of your GPA."
230643,1.0,5.0,CHEM2023,"Feb 8th, 2017", No, Mandatory,, No, Yes,"['TOUGH GRADER', ""SKIP CLASS? YOU WON'T PASS."", 'AMAZING LECTURES']","He is an amazing lecturer but an impossible grader. EM students are required to take 2023 and he grades the tests as if we are senior Chemistry majors not business majors who have never taken a Chem class before. This class is ridiculous but if you can take 2024 I would highly recommend, interesting and easy to pass if you show up and take notes."
230643,4.0,5.0,CHEM1013,"Jan 7th, 2017", Yes,,, No, Yes,"['TOUGH GRADER', ""SKIP CLASS? YOU WON'T PASS."", 'TEST HEAVY']","Hardest chem professor ever. He teaches general chemistry 1 like you should be a chem wiz. He makes you feel like you don't know anything. if you do well in his class though, he likes to possibly recruit you for his research lab. He is very passionate about what he teaches though. helpful outside of class. but HARD class."
230643,4.0,4.0,CHEM1013,"Nov 10th, 2016", Yes, Not Mandatory,, Yes, Yes,"['RESPECTED', 'AMAZING LECTURES']",Great teacher. Hard tests.
230643,2.0,5.0,CHEM1013,"Nov 8th, 2016", Yes, Mandatory, Drop/Withdrawal, No, Yes,"['TOUGH GRADER', 'TEST HEAVY', 'LECTURE HEAVY']","I took Chem as a science elective for my Computer Science major. It was the worst thing I ever did, my roommate who had a different teacher was breezing through chem while I was struggling hoping that I would pass a test one day, eventually I finally had to drop the class in order to keep a good GPA."
230643,4.5,4.0,CHEM2023,"Apr 30th, 2016", No, Mandatory, A,, Yes,[],"Didn't use textbook, solely studied from notes and was fine. If you want the grade it's not impossible and Purser is very helpful but you will have work hard to get it."
230643,3.0,5.0,CHEM1023,"Apr 6th, 2016", Yes, Not Mandatory, Drop/Withdrawal,, Yes,[],"Although Purser is one of the best lecturers Ive ever had, Tests are so hard. if you're a freshman you're enthusiastic about getting purser and think you're up for the challenge, you're wrong. JUST DONT DO IT. withdraw asap, take it in the spring where you're guaranteed to not get him. Unless you're a chem prodigy, this class will screw your GPA."
230643,5.0,4.0,CHEM1013,"Dec 30th, 2015", No, Not Mandatory, A,, Yes,[],"Great teacher, just very hard tests."
230643,3.5,4.0,CHEM1013,"Dec 29th, 2015", Yes, Not Mandatory, A,, Yes,[],"Tests are very tough, but get to use book for them. Doesn't help much unless you do practice problems before. Tests are all of the grade."
230643,1.5,5.0,GENCHEM,"Apr 8th, 2015", Yes, Mandatory, A+,, Yes,[],"I will say this - Dr. Purser is probably the best lecturer I've ever had at TU. He's engaging, energetic, actually cares about a lower level class, etc. HOWEVER, his tests barely correlate to the easiness of the examples hethe text provide and he doesn't give much partial credit. If you haven't taken AP Chem, get ready to do badly."
230643,4.0,5.0,1013,"Dec 7th, 2014", No, Not Mandatory, C,, Yes,[],"Dr. Purser is probably my favorite teacher so far. He's very very good. His lectures are clear, he's very passionate about the material and your knowledge of it. The only downside is that his tests are VERY hard. He expects a lot, but is one of the best teachers I have ever had. Overall, take him if you want to learn--don't if you want an A"
230643,2.0,5.0,CHEM2023,"Jul 14th, 2014", Yes, Mandatory, B,,,[],"He is WAY too hard. As a Business major taking this required class, I felt like I was expected to have knowledge of things to which I have never been privy. I will say that if you show interest in his class in the material, he will make an effort not to allow you to fail."
230643,1.5,5.0,CHEM1013,"Jun 19th, 2014", Yes, Mandatory, Drop/Withdrawal,,,[],He is a good teacher but his tests are unreasonably hard and are nothing like what he lectures or the problems in the book. If you're not a chemistry major FIND A DIFFERENT PROFESSOR. Seriously his tests are so insanely hard and I studied my butt off. Not worth the C.
230643,4.5,3.0,CHEM2023,"Apr 27th, 2014", Yes, Mandatory, A-,,,[],"He's a fair professor, meaning you kind of get what you deserve when it comes to his class, no curves or extra credit but nothing to trip you up either. His lectures were great, easy to follow and he's a wonderful speaker. Warning: don't use your cell phone during class, he'll completely flip if he sees. Also, be on time."
230643,5.0,4.0,CHEM1013,"Jan 8th, 2014", No,,,,,[],"Excellent professor. Tests are challenging, but manageable, and are based on understanding. After the first test, the rest are open book. If you want to learn chemistry, and not just get an easy A, this is your man."
230643,5.0,2.0,CHEM1013,"Dec 6th, 2013", Yes,,,,,[],"A very clear teacher, makes the material easy to understand. No homework, but the tests are semi-difficult. Make sure to study and use the practice tests he gives out. Overall, I've loved having him as a professor."
230643,5.0,5.0,CHEM2013,"Apr 26th, 2013", Yes,,,,,[],"He was a great teacher and really helps students understand the material and doesn't try to show off his intelligence with fancy words. However, his tests kicked my butt. I did make stupid errors but if you practice (just a little bit each day) you can do really well."
230643,5.0,4.0,CHEM2032,"Sep 24th, 2012", No,,,,,[],"Very likely the BEST teacher I've ever had. The class is very difficult, and your grade is composed mostly of two exams the last two days of class. BUT, if there's something you don't understand then it's your own fault. He genuinely wants you to learn the material. If you don't want the same, then your grade will show it."
230643,4.5,5.0,CHEM1013,"Sep 24th, 2012", Yes,,,,,[],"I was scared of Purser's class after reading these ratings, especially since I never had Chemistry. The other comments aren't lying, he's really tough. Dr. P wants to make sure you understand Chemistry, not just be able to regurgitate information on an exam. He is really easy to talk to outside of class, and works with students who put out effort."
230643,2.5,5.0,CHEM1013,"Oct 18th, 2011", Yes,,,,,[],"AVOID!! Entire grade made up of exams, which are nothing like the problems/notes he goes over in class. You love him for three weeks and then everyone drops the class after the first exam. And if he doesn't get you on the first one, he will on the second. I went in to ask about two homework problems..he gave me the wrong answer on both. Not helpful"
230643,1.5,5.0,CHEM2032,"May 4th, 2011", No,,,,,[],The whole grade for the class pretty much came down to TWO finals on the last two days of finals.
